time,body
2022-01-16,"Bitcoin enthusiasts are flocking to Puerto Rico, thanks to tax breaks and an island lifestyle.As the community grows, it's attracting more newcomers from the states as well as curious locals.But not everybody's happy about the influx. In March 2021, crypto entrepreneur and investor David Johnston moved his parents, wife, three daughters, and company with him to Puerto Rico. The 36-year-old, who has been involved in the crypto ecosystem since 2012, says the decision to relocate from Austin was kind of a no-brainer. Beyond the fact that Puerto Rico offers a year-round tropical backdrop with picturesque beaches, the U.S. territory also has crypto-friendly policies, including huge tax breaks to those who spend at least 183 days on the island each year. Residents can keep ahold of their American passports while at the same time not having to pay any taxes on capital gains. It certainly helped seal the deal for Johnston, though for him, the bigger incentive was an overwhelming fear of missing out.""That's where all my friends are. I don't have one friend left in New York, and maybe the pandemic accelerated this, but every single one of them has moved to Puerto Rico,"" he said, noting that many of his California friends have also made the move.  Johnston tells CNBC that after seeing his friends and colleagues decamp, he went to check it out himself in early 2021.""I said, 'Wow, okay, I get it,'"" Johnston recalled of his first impression of the small island territory, whose circumference can be driven in half a day. ""The island has three million people…This is big enough to build a tech center.""Johnston says that Puerto Rico reminds him a lot of Austin in 2012. Back before Tesla, Samsung, and Apple helped turn the Texas capital into one of the country's hottest tech hubs, he says the city felt small. But similar to Puerto Rico today, Austin had a great energy and lots of passionate people moving there, which accelerated over time. So for Johnston, making the move to Puerto Rico feels a whole lot like getting in on the ground floor.""That's where my community is. That's where the people I know and love are going, and they're going there to build something cool. Something that helps everyday people, and that's what I love about open source. That's what I love about blockchain. It's open to everybody,"" he said.  Puerto Rico has fast become the new hot destination for the crypto contingent. Facebook whistleblower Frances Haugen, who told the New York Times she bought crypto ""at the right time,"" made the move from San Francisco to Puerto Rico last year, in part to hang with her ""crypto friends"" on the island. Controversial YouTube star and NFT investor Logan Paul set up shop there, as did crypto billionaire Brock Pierce, a child actor (of ""Mighty Ducks"" fame) turned 2020 indie presidential candidate. Meanwhile, Johnston says his whole office building is filling up with start-ups and crypto companies.""Pantera Capital (a crypto fund) is on the fifth floor and then there's a co-working space on the sixth floor. My company, DLTx, we took over the eighth floor, and NFT.com took over the twelfth floor. That's all happened in the last 12 months,"" Johnston tells CNBC.  Read more about tech and crypto from CNBC ProGoldman Sachs loves Uber, Meta and Amazon — and ranks them in order of preferenceBroadcom bolsters stock with new Apple deal. Here's why the experts like itHere are Cowen's top chip picks for an EV and autonomous-auto future Goldman Sachs loves Uber, Meta and Amazon — and ranks them in order of preferenceBroadcom bolsters stock with new Apple deal. Here's why the experts like itHere are Cowen's top chip picks for an EV and autonomous-auto future Redwood City Ventures, a fund that invests in bitcoin and blockchain companies, has also opened an office in the American territory.For many, the big draw to the island has to do with Act 60, which offers significant tax savings to qualifying residents. In the U.S., investors pay as much as 37% on short-term capital gains and up to 20% on long-term gains, which applies to crypto and other assets held for more than a year. One of the tax breaks under Act 60, known as the Individual Investors Act, drops that tax obligation down to zero if certain qualifications are met. This is especially huge for entrepreneurs and crypto traders.There is also a major tax incentive for business owners to set down roots in Puerto Rico. Mainland companies are subject to a 21% federal corporate tax, plus a state tax, which varies. If a firm exports its services out of Puerto Rico, to the U.S. or really, anywhere else, they pay a 4% corporate tax rate.  CPA Shehan Chandrasekera does caution that any gains realized before arriving to Puerto Rico are still subject to the standard capital gains tax rates on the U.S. mainland. It is just the gains that are earned after becoming a Puerto Rican resident that are excluded from taxes.""That's the part that people are not talking about,"" said Chandrasekera, who heads tax strategy at crypto tax software company CoinTracker.io. But there is a workaround.If an investor has a certain amount of gain, they can go to Puerto Rico, establish residency, sell their stake, and then buy it back as a new position. That way, they avoid muddying the waters with any gains they carry over from the U.S. Puerto Rico's almost too-good-to-be-true tax rules were dreamed up a decade ago to help bring in people and cash at a time when the island was hemorrhaging residents and money. Over the last several years, the territory has suffered a string of bad luck — earthquakes, hurricanes, a multi-year bankruptcy and a global pandemic. Much to the government's relief, investors are now coming in at a record pace. Corporate and tax attorney Giovanni Mendez has been helping to onboard new Puerto Ricans. He tells CNBC that nearly half of his clients right now are either crypto companies or crypto investors, a number that's increased exponentially in the last six years.Mendez, who was raised in a town two hours west of the Puerto Rican capital of San Juan, says that in March 2020, right as the Covid pandemic began to shut down countries around the world, he began speaking with clients about whether to move to Florida (a tax-free state) or Puerto Rico. In the end, many opted for Puerto Rico.""I really wasn't expecting a lot of people to move with everything going on with the pandemic, but to the contrary, a lot of people actually just decided to pull the trigger,"" said Mendez. ""That's certainly coupled with an increase in the value of crypto assets."" Crypto investor George Burke had been thinking about making the move since 2018, but he finally went for it last year.""With the performance of how 2021 was going with bitcoin, and the performance of my company, I knew I needed to make a change, so Puerto Rico became a really good option,"" said Burke.Though Burke wouldn't share an exact dollar figure with CNBC, he did say that his crypto holdings rise to the mid-seven figure range. ""I was in the crowd sale of ethereum…There were only like 6,000 people who were able to do that,"" said Burke, who tells CNBC that he also worked on the first bitcoin debit card back in 2013.As for the move itself, Burke says the process was relatively straightforward.""I got on a plane, I established my residency the same day that I got off the plane just by renting a room at my friend's house, and I started the clock,"" he said. Burke added that he didn't have to apply before arriving. He put in an app for the individual investor's exemption himself, and he paid an attorney $15,000 to help with his business exemption.It was a similar experience for Johnston, who says it took between six and nine months to go through all the perfunctory reviews, though it ""didn't take a huge amount of effort.""""I mean, it's America,"" said Johnston. ""You don't need a visa. You don't have to apply for residency. You don't need a passport. You can just grab a domestic flight and show up in San Juan, grab a driver's license, buy a house, and open an office downtown.""""It was pretty smooth,"" he added.  Before making the move to Puerto Rico, Theodore Agranat tells CNBC that he knew little about Puerto Rico, aside from the fact that it was an American territory. He also recalled seeing images of former President Donald Trump throwing paper towels into a crowd when Hurricane Maria was happening.But after speaking with friends who had made the move and making a scouting trip himself last spring, the 45-year-old felt like Puerto Rico could be the kind of place he had been searching for since his first son was born in 2003: A community of entrepreneur families with kids, comprised of open-minded people who embraced home-schooling and alternative diets — Agranat himself is into raw foods — while at the same time functioning much like a start-up incubator, bringing together business-savvy and creative minds. He found just that in the southeast Puerto Rican city of Humacao.Agranat, who runs an early-stage blockchain investment fund that put money into over 225 projects last year, says the financial incentives were also a huge draw.  Thus far, island life is working out pretty well. Agranat and his wife home-school their three children, and for their 14-year-old, they've customized the curriculum to include crypto-related topics, including NFTs, crypto games, and token swapping.Johnston, who lives in the San Juan suburb of Guaynabo, has adopted a similar approach. He and his wife home-school all three of their children, and crypto has been a part of the lesson plan since day one.""My kids have had crypto wallets since they were born,"" Johnston told CNBC. ""When they did chores for grandma, grandma tried to pay them in cash once, and they said, 'No thanks, grandma. I prefer bitcoin.'""Outside of the suburbs, many gather for Crypto Mondays, a weekly meet-up held at nice hotels and restaurants in the capital, as well as Crypto Curious, which draws people new to the space and covers topics like NFTs, DeFi, and how to open your own crypto wallet. Hundreds of locals have begun to partake in those gatherings, which are now also being offered in Spanish. Burke, who says that his friends and crypto colleagues have been moving to Puerto Rico since the last bitcoin bull run in 2017, tells CNBC that every Thursday, he attends a luncheon with around 30 to 40 other crypto-minded folks who live in either Condado Beach or Old San Juan.  Not everyone is happy about the influx of new residents.For one, locals aren't thrilled about the fact that they don't qualify for the capital gains tax exemption, which is designed for non-Puerto Ricans. Mendez tells CNBC the local rate in Puerto Rico is 15% for long-term capital gains, and the disparity has strained relations between some locals and new residents. An organization that goes by #AbolishAct60 has pushed back on the tax breaks via social media.There is also a question as to whether the tax breaks are achieving what the government set out to do, including, among other things, creating jobs, and sinking more cash into the local economy. Economist and Nobel-prize winner Joseph Stiglitz told a crowd in San Juan in December that he was skeptical of the economic benefits of the tax scheme.The flood of the crypto rich into Puerto Rico has also helped to drive up real estate prices. ""The lack of inventory and the high demand has resulted in prices that we have never seen before in Puerto Rico,"" said Francisco Diaz Fournier of Luxury Collection Real Estate.""I've been tracking the markets for several years, and I was not expecting this…You have properties in Dorado Beach that have been sold for more than $20 million,"" said Fournier, who tells CNBC that there are other properties listed on the market right now for $27 million, $30 million, and $34 million, numbers which have increasingly become par for the course.Rising real estate prices and the growing cost of living have fanned the flames of resentment.But Keiko Yoshino, who was a government employee in Washington, D.C., for seven years before making the move to Puerto Rico, is trying to close this divide by running programs that pull the two groups together to facilitate a knowledge transfer. Which, in theory, is part of what the tax incentive program set out to do in the first place.Yoshino, who runs the Puerto Rico Blockchain Trade Association, plays a major role in planning and running Crypto Curious meet-ups. But a big part of what she's trying to do is dispel stereotypes.""I had been called a crypto colonizer,"" Yoshino said. ""I'm not crypto rich. I was a government employee for seven years. I don't even have incentives….We need to work on stereotypes going both ways. That's what I really like about crypto: It's not a political issue. It doesn't need to be a social issue. It's an opportunity to build community."""
2022-01-16,"Walmart appears to be venturing into the metaverse with plans to create its own cryptocurrency and collection of NFTs.The big-box retailer filed several new trademarks late last month that indicate its intent to make and sell virtual goods.In a separate filing, Walmart said it would offer users a virtual currency, as well as non-fungible tokens, or NFTs. Walmart appears to be venturing into the metaverse with plans to create its own cryptocurrency and collection of non-fungible tokens, or NFTs.The big-box retailer filed several new trademarks late last month that indicate its intent to make and sell virtual goods, including electronics, home decorations, toys, sporting goods and personal care products. In a separate filing, Walmart said it would offer users a virtual currency, as well as NFTs.According to the U.S. Patent and Trademark Office, Walmart filed the applications on Dec. 30. In total, seven separate applications have been submitted.In a statement, Walmart said it is ""continuously exploring how emerging technologies may shape future shopping experiences."" It declined to comment on the specific trademark filings.""We are testing new ideas all the time,"" the company added. ""Some ideas become products or services that make it to customers. And some we test, iterate and learn from."" ""[The filings are] super intense,"" said Josh Gerben, a trademark attorney. ""There's a lot of language in these, which shows that there's a lot of planning going on behind the scenes about how they're going to address cryptocurrency, how they're going to address the metaverse and the virtual world that appears to be coming or that's already here.""Gerben said that ever since Facebook announced it was changing its company name to Meta, signaling its ambitions beyond social media, businesses have been rushing to figure out how they will fit into a virtual world. Nike filed a slew of trademark applications in early November that previewed its plans to sell virtual branded sneakers and apparel. Later that month, it said it was teaming up with Roblox to create an online world called Nikeland. In December, it bought the virtual sneaker company RTFKT (pronounced ""artifact"") for an undisclosed amount.""All of a sudden, everyone is like, 'This is becoming super real and we need to make sure our IP is protected in the space,' "" said Gerben.Gap has also started selling NFTs of its iconic logo sweatshirts. The apparel maker said its NFTs will be priced in tiers ranging from roughly $8.30 to $415, and come with a physical hoodie.Elsewhere, both Under Armour's and Adidas' NFT debuts sold out last month. They're now fetching sky-high prices on the NFT marketplace OpenSea.Gerben said that apparel retailers Urban Outfitters, Ralph Lauren and Abercrombie & Fitch have also filed trademarks in recent weeks detailing their intent to open some sort of virtual store.A report from CB Insights outlined some of the reasons why retailers and brands might want to make such ventures, which can potentially offer new revenue streams.Launching NFTs makes it possible for businesses to ""tokenize"" physical products and services to help reduce online transaction costs, it said. And for luxury brands like Gucci and Louis Vuitton, NFTs can serve as a form of authentication for tangible and more expensive goods, CB Insights noted.Gerben said that as more consumers familiarize themselves with the metaverse and items stored on the blockchain, more retailers will want to create their own ecosystem around it.According to Frank Chaparro, director at crypto-information services firm The Block, many retailers are still reeling from being late to e-commerce, so they don't want to miss out on the metaverse.""I think it's a win-win for any company in retail,"" Chaparro said. ""And even if it just turns out to be a fad, there's not a lot of reputation damage in just trying something weird out like giving some customers an NFT in a sweepstake, for instance.""—CNBC's Melissa Repko contributed to this report."
2022-01-16,Bitcoin bulls have long believed that the cryptocurrency's best use is as a hedge against inflation or a safe-haven asset in times of uncertainty.
2022-01-18,"Coinbase customers will be able to use Mastercard credit and debit cards to make purchases the crypto company's upcoming NFT marketplace.The deal is the latest in a flurry of crypto partnerships for Mastercard and Visa.Bitcoin and other cryptocurrencies were created to get around banks and intermediaries. But payment giants have embraced the asset class as it becomes mainstream. Mastercard said Tuesday it inked a deal with Coinbase, the latest in a recent flurry of partnerships between payment and cryptocurrency giants.As part of the agreement, Coinbase customers will be able to use Mastercard credit and debit cards to make purchases on the crypto exchange's upcoming NFT marketplace. Coinbase unveiled late last year plans to launch the platform for minting and buying nonfungible tokens, which have exploded in popularity over the past 12 months.By teaming up with Mastercard, Coinbase executives said they're looking to reduce friction in the NFT buying process. Right now, that often requires customers opening up a crypto wallet, buying digital currencies, then spending those on NFTs in an online marketplace. Mastercard, meanwhile, said it's looking to help expand consumer choice on how to pay for NFTs.""Getting more people involved safely and securely is perhaps the best way to help the NFT market thrive. As it does, Mastercard sees even greater potential for NFTs' underlying tech to go beyond art and collectibles into many more areas,"" Mastercard's Raj Dhamodharan said.Mastercard, one of the world's largest credit card and payment companies, has been on a crypto partnership spree lately. Mastercard announced in October that it's teaming up with Bakkt to let banks and merchants in its network offer crypto-related services. It has also partnered up with Gemini, BitPay and Mintable, among others.Rival Visa has been equally active the crypto space. The company has more than 60 partnerships with companies in the space, including the one with Coinbase. American Express has also said it's exploring using its cards and network with stablecoins. But CEO Stephen Squeri recently told Yahoo Finance that consumers should not expect to see an Amex-crypto-linked card ""anytime soon.""Cryptocurrencies like bitcoin were first designed to get around banks and intermediaries. But banks and payment companies have embraced those technologies as cryptocurrencies become mainstream.Mizuho Securities analyst Dan Dolev said in an email that Tuesday's announcement as another example of Mastercard's ""out-of-the-box thinking"" in its approach to crypto. Over the long-term, though, Dolev said blockchain technologies and decentralized finance ""can be a threat to the overall network ecosystem as they are challenging the trusted third party concept.""Subscribe to CNBC PRO for exclusive insights and analysis, and live business day programming from around the world."
2022-01-18,"After a rough start to the year, the price of bitcoin is about flat in the last seven days. The largest cryptocurrency by market value is currently trading at $41,671, according to Coin Metrics.Ether, the second-largest, is up about 2% in the same time frame. It's now priced at $3,113.Other top coins had a better week. Cardano, Terra and Dogecoin, for example, jumped over the last seven days, Coin Gecko data shows.Along with price movement, here are six important things that happened in the crypto space last week. In June, Kim Kardashian posted an Instagram Story promoting a cryptocurrency called EthereumMax.""Are you guys into crypto???"" she wrote. ""This is not financial advice but sharing what my friends told me about the Ethereum Max token!"" Kardashian included the hashtag ""#ad,"" which indicates that the post was paid for as promotional content.A class action lawsuit in the U.S. District Court for the Central District of California was then filed on January 7, accusing Kardashian and other celebrities, like Floyd Mayweather, of ""making false or misleading statements"" about EthereumMax to allegedly increase its price.Ryan Huegerich, a New York resident, filed on behalf of himself and other investors who bought EthereumMax between May 14, 2021 and June 17, 2021. The lawsuit claims Huegerich and others lost money on their investments.Representatives for Kardashian and Mayweather were not immediately available for comment when contacted by CNBC. A spokesperson for EthereumMax told CNBC that the lawsuit was ""riddled with misinformation"" and disputed accusations that it was a scam. On Wednesday, Twitter and Block founder Jack Dorsey announced plans to create a ""Bitcoin Legal Defense Fund.""""The Bitcoin Legal Defense Fund is a non-profit entity that aims to minimize legal headaches that discourage software developers from actively developing Bitcoin and related projects,"" Dorsey wrote in an email.The fund will defend bitcoin developers from lawsuits, ""including finding and retaining defense counsel, developing litigation strategy and paying legal bills,"" with volunteer and part-time lawyers, he wrote. On Thursday, Dorsey confirmed that Block, formerly known as Square, will be ""officially building an open bitcoin mining system,"" he tweeted on Thursday. The company first announced that it was considering the project in October.Bitcoin operates on a proof of work (PoW) model, where miners must compete to solve complex puzzles in order to validate transactions. The process isn't easy: It requires a lot of energy and computer power, which isn't cheap. The computers themselves, along with other equipment, can also be very expensive. Read more about tech and crypto from CNBC ProWatch Elon Musk's full interview with CNBC's David Faber on Twitter, Tesla and A.I. advancesBuy this under-the-radar chip stock, which can see upside of more than 20%, Jefferies saysNvidia's stock could rise fivefold in 10 years on A.I. trend, says fund manager Watch Elon Musk's full interview with CNBC's David Faber on Twitter, Tesla and A.I. advancesBuy this under-the-radar chip stock, which can see upside of more than 20%, Jefferies saysNvidia's stock could rise fivefold in 10 years on A.I. trend, says fund manager With these types of difficulties in mind, the project's goal is to make mining bitcoin, the largest cryptocurrency by market value, ""more distributed and efficient,"" tweeted Thomas Templeton, the company's general manager for hardware.Templeton mentioned that there are a number of ""customer pain points"" and ""technical challenges"" in the mining community that Block hopes to address, including mining rig availability, high price, reliability and power consumption. Dorsey has continued to focus more on bitcoin since his departure from Twitter in November.On Monday, he announced that Block's Cash App integrated with the Lightning Network, which enables faster, cheaper bitcoin transactions. This now allows Cash App users in the U.S., except those in New York, to send bitcoin for free to anyone globally. On Friday, Elon Musk announced that Tesla is accepting dogecoin, a meme-inspired cryptocurrency, for certain merchandise.This includes 835 coins for a ""Giga Texas Belt Buckle"" and 300 coins for a ""Cyberwhistle,"" among other items. That's about $134 and $48, respectively, at current prices.The price of dogecoin jumped more than 15% on Friday following the news and topped 20 cents before leveling off. It's now trading at 16 cents, according to Coin Metrics. On Sunday, Crypto.com wrote on Twitter that ""we have a small number of users reporting suspicious activity on their accounts. We will be pausing withdrawals shortly, as our team is investigating. All funds are safe.""Peckshield, a blockchain security and analytics company, said that Crypto.com lost about $15 million. Other publications reported an alleged hack as well, but Crypto.com has not confirmed online.Crypto.com declined CNBC Make It's request for comment.""No customer funds were lost,"" CEO Kris Marszalek tweeted on Monday.Sign up now: Get smarter about your money and career with our weekly newsletterDon't miss: Arkansas is offering remote tech workers $10,000 in bitcoin to move to there"
