time,body
2022-01-10,"Former aides to Sen. Joe Manchin who are now lobbyists are scoring big clients as their ex-boss battles President Biden's agenda.Three of Manchin's previous advisors have recently registered to lobby for at least five new, high-profile clients.The former aides – including former chiefs of staff to Manchin – registered to lobby for some of these new clients starting in October, while registering for others as recently as December. Former aides to Sen. Joe Manchin who are now lobbyists are scoring big, influential clients as their ex-boss battles President Biden's agenda.Three of Manchin's previous advisors have recently registered to lobby for at least five new clients: gas and oil giant Hess, media juggernaut Comcast, a nonprofit founded by a former campaign manager for Mike Bloomberg, a group with ties to former presidential candidate Andrew Yang, and an organization partially funded by crypto billionaire Sam Bankman-Fried. The billionaire gave $5 million to a pro-Biden political action committee during the 2020 election.The former aides – including former chiefs of staff to Manchin – registered to lobby for some of these new clients starting in October, while registering for others as recently as December, according to disclosure reports reviewed by CNBC. The lobbying registrations came as Manchin's own influence grew. Manchin, a conservative Democrat from West Virginia, opposed key elements of President Joe Biden's proposals during the October-December period. Several of the issues listed on the lobbying disclosure forms are related to the Democratic Party's agenda, such as the child tax credit, income tax and greater access to broadband. The lobbying registration reports do not say whether these representatives are engaging for or against the various proposals. CNBC PoliticsRead more of CNBC's politics coverage:Republicans question June 1 debt ceiling deadline as talks zero in on potential trade-offsOracle's Larry Ellison gears up to spend millions to back Tim Scott's 2024 runTrump faces $10 million defamation claim by E. Jean Carroll after CNN town hall remarks Read more of CNBC's politics coverage:Republicans question June 1 debt ceiling deadline as talks zero in on potential trade-offsOracle's Larry Ellison gears up to spend millions to back Tim Scott's 2024 runTrump faces $10 million defamation claim by E. Jean Carroll after CNN town hall remarks In December, Manchin said he wouldn't vote for Biden's $1.75 trillion social spending and climate policy plan, which is known as ""Build Back Better."" Manchin's vote is critical for Democrats in a 50-50 Senate. The West Virginia lawmaker has since said he's had no talks with top Democrats about revisiting the plan.Several of the Manchin-linked lobbyists have previously engaged people on Capitol Hill on behalf of power players in industries such as coal, pharmaceuticals, oil and gas, tobacco and finance.A spokeswoman for Comcast declined to comment. The lobbyists and representatives for the new clients did not return requests for comment. Comcast hired Larry Puccio, who counts himself as a friend of Manchin's, to lobby on what's described on the registration form as ""telecommunications – broadband deployment and adoption."" Puccio registered to lobby for Comcast in late November and was Manchin's chief of staff when he was governor of West Virginia.Biden recently signed a $1 trillion infrastructure bill that includes $550 billion in new money that is targeted toward transportation, broadband and utilities.In a 2020 interview with a local news outlet in West Virginia, Puccio, a longtime lobbyist, discussed his friendship with Manchin. ""Joe and I are very close. I think the world of Joe. I hope you print that. I've always been supportive of Joe Manchin. Joe knows me and I know Joe,"" Puccio said at the time.Hess recently hired Patrick Hayes, who was Manchin's chief of staff until 2019. Hayes registered to lobby for the oil and gas giant in December. He is focused on global intangible low-taxed income, or GILTI, according to the registration form. Changes to GILTI are part of the House-passed Build Back Better bill that has stalled in the Senate due to Manchin's opposition.Manchin is the chair of the Senate Energy Committee and has profited from his links to the coal industry. He also opposes key climate provisions in the Build Back Better bill. Puccio and Hayes also picked up two influential nonprofits as new clients.Tusk Philanthropies, is a 501(c)(4) founded by former Bloomberg campaign manager Bradley Tusk, lists Hayes as one their new lobbyists from the firm Kountoupes Denham Carr & Reid. The lobbying firm says Hayes and his colleagues registered to lobby for Tusk Philanthropies in October with a focus on ""initiatives related to ending childhood hunger including the Community Eligibility Provision.""Records show that Tusk Philanthropies has hired lobbyists in the past to try to fight for their priorities. The group's website lists fighting child hunger as one of its goals. The site says the group has been ""able to help pass legislation in Illinois, Maine, Maryland, Massachusetts, North Carolina, Oregon, Pennsylvania, Utah, Arizona, California, New York, New Jersey, Texas, and Washington state.""Former presidential contender and New York City mayoral candidate Andrew Yang launched a nonprofit called Humanity Forward after he dropped out of the 2020 Democratic presidential primary. The 501(c)(4) recently hired Puccio to focus on the child tax credit, according to the registration form. Puccio registered to lobby for the Yang backed group in early December.The expansion of the child tax credit was a major feature of Biden's social spending proposal that has since stalled largely due to Manchin's opposition.The group's website says that the organization has been actively working to expand the provision as it is set to expire.""Humanity Forward worked with partner organizations and members of Congress on both sides of the aisle to pass the expanded monthly Child Tax Credit payments as part of the American Rescue Plan Act and is actively advancing efforts to prevent its expiration in December 2021,"" the website says. A nonprofit that says it supports Biden's proposal to spend $30 billion to protect the United States from future pandemics hired lobbyist Jonathan Kott, who was Manchin's senior advisor and communications director for seven years. Kott registered to lobby for Guarding Against Pandemics in November for what the form says is ""issues regarding pandemic preparedness funding.""The 501(c)(4)'s website says the group is ""pushing Congress to include a $30 billion investment in Democrats' upcoming budget reconciliation bill — less than 1% of the total cost of the bill — to prepare for the next pandemic.""The website also says the group is partially funded by Sam Bankman-Fried, who has a net worth of $26 billion, according to Forbes. He is the founder and CEO of cryptocurrency exchange FTX.Disclosure: Comcast owns NBCUniversal, the parent company of CNBC."
2022-01-11,"A pure-play bitcoin-based exchange-traded fund could finally make its way to investors in 2022, one top financial advisor said.""I've been making that prediction every year for seven years. One day I'm going to be right,"" Edelman Financial Engines founder Ric Edelman told CNBC's ""ETF Edge"" on Monday.""The reason that I'm hopeful that it's going to occur if not in '22, then in 2023, is because the SEC is running out of excuses to say no.""Market maturity and innovation have addressed many of the Securities and Exchange Commission's hesitations around approving pure-play bitcoin ETF products, Edelman said.""One of the big concerns that they raised, that Chairman Gensler has raised, is that they can't control it well enough. Well, they can't control gold or oil, either,"" he said.""Without an ETF, consumers are going elsewhere, often getting involved in frauds and other schemes, because they can't get the product via a financial advisor. The SEC is going to say yes because they're going to realize this is a step toward consumer protection.""Edelman expects one-third of Americans to own bitcoin by the end of 2022 as cryptocurrency becomes ""more and more mainstream."" Currently, about a quarter of Americans own bitcoin, he said.""A lot more people know about it and are investing in it than most realize. It's kind of like teenagers buying beer. They're doing it, they just don't want you to know about it,"" he said.The industry's efforts to quell the SEC's concerns could finally bear fruit this year, Bitwise's Matthew Hougan agreed.""Eventually the cumulative weight of evidence will force them to move forward with an approval,"" the firm's chief investment officer said in the same interview. ""I'm very hopeful we get it this year.""The SEC may have ""gotten what it wanted"" in forcing the digital asset market to mature over the years, but now, ""it's time to get over the hump,"" Hougan said.""It's time to deliver to the American investors the lower cost and better protections and easier access that an ETF can provide,"" he said. ""We're getting there. I think we may get over the hurdle this year.""Crypto assets have declined significantly in recent weeks, with bitcoin futures ETFs such as the ProShares Bitcoin Strategy ETF (BITO) down 30%-40% from their recent highs. The Bitwise 10 Crypto Index Fund (BITW) is down more than 74% from its 52-week high.The SEC did not immediately respond to CNBC's request for comment. Disclaimer"
2022-01-11,"When considering any cryptocurrency investment, billionaire investor Mark Cuban looks for utility in each project.That's why, to him, ""tokens trading are the least important part of crypto,"" he tweeted on Tuesday.Instead, Cuban sees smart contracts, or collections of code that power decentralized applications, and how they're used within projects as the most important use case. For example, smart contracts are essential in powering decentralized finance, or DeFi, applications and nonfungible tokens, or NFTs. In addition, they're instrumental in forming decentralized autonomous organizations, or DAOs.""Being able to create businesses on decentralized platforms leveraging smart contracts, validators, DAOs and more create a unique ability to offer more efficient biz processes and disrupt industries,"" the ""Shark Tank"" investor and Dallas Mavericks owner said.This also applies to everyday investors and what they should look for when considering investing in a crypto-related project too, Cuban tells CNBC Make It.""Always look for the utility,"" he says. ""That is where value is created.""This isn't surprising, as Cuban has repeatedly mentioned his belief in investments due to their utility, naming smart contract capabilities as an example. In the past, he's even attributed this way of thinking to why he's an ""Ethereum maxi."" ""Smart contracts can change the world,"" he previously told CNBC Make It.Nonetheless, financial experts warn that cryptocurrency is a risky, volatile and speculative investment. They warn to only invest what you can afford to lose.Cuban is an avid investor in the space, with a cryptocurrency portfolio of various digital coins, NFTs and investments in many blockchain companies.Disclosure: CNBC owns the exclusive off-network cable rights to ""Shark Tank.""Sign up now: Get smarter about your money and career with our weekly newsletterDon't miss: What Mark Cuban is most excited for in the crypto space next year"
2022-01-11,"Investments related to cryptocurrencies and digital assets are the top threat to investors ""by far,"" according to a survey of securities regulators.The annual survey of North American securities regulators urged investors to exercise caution before purchasing popular and volatile unregulated investments, especially those involving cryptocurrency and digital assets. Investments related to cryptocurrencies and digital assets are the top threat to investors ""by far,"" according to new data from the North American Securities Administrators Association (NASAA).""Stories of 'crypto millionaires' attracted some investors to try their hand at investing in cryptocurrencies or crypto-related investments this year, and with them, many stories of those who bet big and lost big began appearing, and they will continue to appear in 2022,"" said Enforcement Section Committee Co-Chair Joseph P. Borg, Alabama Securities Commission Director.The annual survey of North American securities regulators urged investors to exercise caution before purchasing popular and volatile unregulated investments, especially those involving cryptocurrency and digital assets.""The most common telltale sign of an investment scam is an offer of guaranteed high returns with no risk. It is important for investors to understand what they are investing in and with whom they are investing,"" said Melanie Senter Lubin, NASAA President and Maryland Securities Commissioner.""Education and information are an investor's best defense against investment fraud,"" continued Lubin.The report added that digital assets ""do not fall neatly into the existing investor regulatory framework,"" so it may be easier for promoters of these products ""to fleece the public."" ""Before you jump into the crypto craze, be mindful that cryptocurrencies and related financial products may be nothing more than public facing fronts for Ponzi schemes and other frauds,"" said Enforcement Section Committee Vice-Chair Joseph Rotunda.Rotunda added that investments in cryptocurrency trading programs, interests in crypto mining pools, crypto depository accounts and securitized tokens should ""be seen for what they are: extremely risky speculation with a high risk of loss.""Scammers took home a record $14 billion in cryptocurrency in 2021, thanks in large part to the rise of decentralized finance (DeFi) platforms, according to blockchain analytics firm Chainalysis.DeFi is a rapidly growing sector of the crypto market that aims to cut out middlemen, such as banks, from traditional financial transactions, like securing a loan, by using blockchain technology.Losses from crypto-related crime rose 79% from a year earlier, driven by a spike in theft and scams.Scamming was the greatest form of cryptocurrency-based crime in 2021, followed by theft — most of which occurred through hacking of cryptocurrency businesses. Chainalysis says that DeFi is a big part of the story for both, in yet another warning for those dabbling in this emerging segment of the crypto industry.NASAA noted that many of the fraud threats facing investors today involve private offerings, which are exempted from federal law registration requirements. States are also preempted from enforcing investor protection laws related to these private securities.""Unregistered private offerings generally are high-risk investments and don't have the same investor protection requirements as those sold through public markets,"" said Borg.Ultimately, state securities regulators say that if it sounds too good to be true, it probably is.Some DeFi platforms, for example, offer users huge returns, such as high-interest rate savings and lending products.Bad actors often entice new investors by promising the payment of safe, lucrative, guaranteed returns over relatively short terms – ""sometimes measured in hours or days instead of months or years,"" according to NASAA, which says these kinds of promises are a red flag for fraud.Fraud offerings tied to promissory notes, money scams offered online and via social media, as well as financial schemes connected to self-directed Individual Retirement Accounts rounded out the survey's list of the top threats to retail investors."
2022-01-12,"New documents show that in 2019 Jared Kushner was quietly advocating for a U.S. digital dollar, according to a 250-page dump of Treasury Secretary Steven Mnuchin's crypto-related e-mail correspondence from his four years in the job.Kushner's apparent affinity for digital currencies is one of many revelations gleaned from this newly released document that was obtained by CoinDesk through a Freedom of Information Act request.Other insights include details surrounding the fight between the crypto lobby and Mnuchin over the Treasury Department’s last-minute attempt at rolling out new rules pertaining to user-controlled digital wallets. New documents show that one of former President Donald Trump's most trusted and senior advisors was secretly pushing the White House to lean into crypto, well before skyrocketing crypto prices reignited mainstream interest in the space.In 2019, when crypto was in the midst of a multiyear bear market, Jared Kushner — Trump's son-in-law and a senior adviser — was quietly advocating for a U.S. digital dollar, in which the Fed would launch its own central bank currency.The information was gleaned from a 250-page dump of Treasury Secretary Steven Mnuchin's crypto-related e-mail correspondence from his four years in the job, which was was obtained by CoinDesk through a Freedom of Information Act request.Other insights include details surrounding the fight between the crypto lobby and Mnuchin over the Treasury Department's last-minute attempt at rolling out new rules pertaining to user-controlled digital wallets.Neither Mnuchin nor Kushner immediately responded to CNBC's request for comment about their crypto-related email exchanges. On May 29, 2019, Kushner, who was more known for his work on the administration's foreign-policy efforts rather than fiscal matters, sent an e-mail to Mnuchin to suggest that a group be assembled to ""have a brainstorm"" about the topic of a U.S. digital currency.The note included a link to a blog post by OpenAI CEO Sam Altman in which Altman argues that while the U.S. government cannot stop cryptocurrency, it can ""create the winner."" In the post, Altman riffed on a hypothetical U.S. digital currency, or USDC, which would function as a second legal currency. He goes on to say that if the U.S. was the first superpower government to launch a central bank digital currency, or CBDC, it would have an ""enviable position in the future of the world"" and exercise some degree of power over a worldwide currency.""My sense is it could make sense and also be something that could ultimately change the way we pay out entitlements as well saving us a ton in waste fraud and also in transaction costs,"" Kushner wrote.There was no reply from Mnuchin among the documents, so it is unclear whether the Treasury secretary took any action.Kushner's view on the CBDC phenomenon ultimately proved prescient.Few countries were seriously dabbling in national digital currencies in mid-2019, but today, at least 87 countries representing over 90% of global GDP are exploring a CBDC, according to research from the Atlantic Council.China is miles ahead of the rest of the world, having spent years developing and piloting its digital yuan. Beijing is currently in the process of ramping up efforts to roll out the so-called e-CNY to the broader population, with the ultimate goal of replacing cash and coins already in circulation.In the years since Kushner floated the idea of a digital dollar, talk of a CBDC in the U.S. has circulated among regulators and lawmakers, though with few tangible steps toward implementation.During a two-day congressional hearing in July, Federal Reserve Chairman Jerome Powell said the main incentive for the U.S. to launch its own CBDC would be to eliminate the case for crypto coins in America.""You wouldn't need stablecoins; you wouldn't need cryptocurrencies, if you had a digital U.S. currency,"" Powell said. ""I think that's one of the stronger arguments in its favor.""America's most likely path on CBDC would be to create a digital twin of the dollar, observers say. It would be fully regulated, under a central authority, and with the full faith and backing of the country's central bank.""A dollar in CBDC form is a liability of the central bank. The Federal Reserve has to pay you back,"" explained Ronit Ghose, who heads FinTech and digital assets for Citi Global Insights.Though former Commodity Futures Trading Commission Chairman Chris Giancarlo has since taken up the cause for a digital dollar, the full commitment of the Fed remains in doubt. Powell previously told lawmakers on Capitol Hill that he was not convinced that the benefits outweigh the costs. Before Giancarlo began spearheading the so-called Digital Dollar Project, the former CFTC chairman was among those addressing Mnuchin on the crypto topic.An e-mail exchange from July 2018 shows that Giancarlo, via his executive assistant, was adamant about setting up time for an in-person meeting with the Treasury secretary.When CNBC asked about the White House meeting, Giancarlo said he could not recall that specific request, but added that throughout 2018, he ""routinely apprised Secretary Mnuchin of ongoing operation and supervision of the bitcoin futures market launched under CFTC oversight in December 2017.""   Giancarlo also told CNBC that it was ""quite likely"" that he had informed Mnuchin about his growing concerns surrounding the potential adverse impact of a ""Hard Brexit"" on London-based swaps clearing under the joint supervision of the CFTC and the Bank of England. Mnuchin's office expressed interest in some other countries' crypto plans as well, according to the new documents.In Sept. 2019, Mnuchin's team seemed particularly interested in Venezuela's announcement that it would use cryptocurrencies as a way to facilitate free national and international payments. The move could have helped the Venezuelan government circumvent U.S. sanctions, which had largely isolated the state from the global economy.Monica Crowley, then the Treasury's assistant secretary for public affairs, sent off a Bloomberg News headline via email to Mnuchin that read, ""Maduro says Venezuela to activate crypto payment method 'soon,' "" to which the Treasury chief replied, ""Let's discuss."" In his final months at Treasury, Mnuchin apparently argued with the blockchain lobby over his plan to impose new rules on user-hosted cryptocurrency wallets.Part of the problem had to do with concerns over privacy and the difficulty of fully meeting compliance requirements. The proposal would have required crypto exchanges to collect counterparty information, including names and addresses, from those looking to send or receive crypto from a self-hosted wallet.The timing was also rushed.The Financial Crimes Enforcement Network, or FinCEN, proposed the rule a week before Christmas 2020, after Joe Biden had been elected as the next president but before he took office. Although this deadline was extended multiple times, FinCEN initially offered only a 15-day public comment window on the proposal. Typically, comment periods run 30 to 90 days.The Blockchain Association, which had reached out to Mnuchin a month before the proposal was formally put forth, enlisted the help of an attorney. Kirkland & Ellis lawyer Paul Clement wrote a letter to Mnuchin on the association's behalf, saying that ""the notion that stakeholders could meaningfully engage with a rule that touches on more than 24 separate subjects in such a highly truncated period would be doubtful even in the ordinary course.""Clement warned, ""Thus, what purports to be just a reporting requirement may well operate as a de facto ban,"" according to the documents.The Blockchain Association wasn't alone in urging Mnuchin to re-think the new crypto rule. Correspondence shows that others suggested he lose the counterparty disclosure requirement. Ultimately, nothing came of the proposal."
