time,body
2022-01-20,"The stock opened at a high of $5.25 Singapore dollars before paring gains to close at $5.05 Singapore dollars, up 1% from its offer price.VTAC raised $200 million from investors including other Temasek subsidiaries Venezio Investments and Fullerton Fund Management.The company will seek to acquire at least one business within two years of its listing date, and will focus on areas such as cybersecurity, artificial intelligence and fintech. SINGAPORE — Singapore's first blank check company started trading on the country's stock exchange on Thursday afternoon, four months after the bourse launched new rules allowing special purpose acquisition companies (SPACs) to list.Vertex Technology Acquisition Corporation (VTAC), is sponsored by Vertex Venture Holdings, a wholly owned subsidiary of state investor Temasek Holdings.The SPAC's initial public offering of 11.8 million units had an offer price of $5 Singapore dollars. The retail tranche of 600,000 units was 36 times subscribed.The stock opened at a high of $5.25 Singapore dollars before paring gains to close at $5.05 Singapore dollars, up 1% from its offer price.The company raised $200 million Singapore dollars (more than $148 million) from investors including other Temasek subsidiaries Venezio Investments and Fullerton Fund Management.VTAC will seek to acquire at least one business within two years of its listing date, and will focus on areas such as cybersecurity, artificial intelligence and fintech.SPACs have become very popular recently and are established solely to raise capital from investors in order to acquire one or more operating businesses. They raise money in an initial public offering and use the cash to merge with a private firm, in order to take the company public and bypass traditional IPO processes which can be lengthy. Singapore may be able to draw companies to its stock market through its push for SPACs, said Ringo Choi, EY Asia-Pacific IPO leader.""Companies may be considering to be listed in Hong Kong or say Malaysia or other ASEAN countries, but they will prefer to go for this Singapore SPAC IPO if they have this opportunity,"" he told CNBC's ""Street Signs Asia"" on Thursday.He pointed out that the blank check company was heavily oversubscribed, and the firms may be able to price shares higher in Singapore.That could be a boost for the city state, which has seen average IPO sizes decline and thin liquidity in recent years, Choi said. The authorities want Singapore to be a competitive financial hub with high trading volumes, and were eager to introduce new pathways, he said.Singapore is one of the first markets in Asia to allow such listings. Michael Marquardt, CEO of investor services company IQ-EQ Asia, described Singapore's approach to SPACs as conservative because it only relaxed its regulations last year.""This strategy has provided investors with the confidence they need to trigger new SPAC listings,"" he said in an email. The commitment to create a safe and regulated capital market environment will benefit SPACs in the long run by attracting more inflows, he said.Marquardt also predicted that more SPACs will start to list in Asia's financial hubs.""Given the changes to Hong Kong's listing regime that came into effect at the start of the year, these rule revisions across both jurisdictions will serve to encourage SPAC activity in Asia,"" he said."
2022-01-21,"The cryptocurrency market, along with other riskier assets, is taking a big hit.Bitcoin is down 11% in the last 24 hours, according to CoinGecko. Hitting its lowest level since August, the largest cryptocurrency by market value dropped below $40,000 on Friday, and is currently trading at around $38,378. Some analysts predict that it could fall even lower.Along with it, ether, the second-largest, is down 14% in the same timeframe. It's currently trading around $2,779.This comes as the Nasdaq and S&P 500 suffer losses as well. Cryptocurrencies and tech stocks have been falling at the same time this month, showing an increasing correlation between the two.Additionally, there's concern over the potential for more cryptocurrency regulation in the U.S., as well as how the Federal Reserve potentially dialing back its monetary policy would impact the overall market. Globally, other regulators are focusing on cryptocurrency markets as well. On Thursday, for example, Russia's central bank proposed banning the use and mining of cryptocurrencies.This dip isn't unusual for bitcoin; cryptocurrencies are known for their volatility. As quickly as prices rise, they can tumble back down. Because of this, experts say it's important to consider if you can handle the ups and downs before investing in bitcoin or any other cryptocurrency.""It's a very volatile asset class,"" Anjali Jariwala, certified financial planner, certified public accountant and founder of Fit Advisors, previously told CNBC Make It. ""You have to be comfortable with the swings and you have to be comfortable also losing your money.""Each investor's risk tolerance will vary. It's important to understand how much you can personally tolerate.For some people, the volatility ""may be OK, that may coincide with your appetite for risk and your own risk tolerance and investment time horizon,"" Douglas Boneparth, certified financial planner and president of Bone Fide Wealth, previously told CNBC Make It. ""But, you still got to live with it."" Other investors may prefer something more stable.Regardless of your tolerance level, financial experts warn that this volatility makes bitcoin and other cryptocurrencies a riskier investment than something like a low-cost index fund, which allows investors to buy a collection of stocks at once, rather than bet on a single asset.If you decide to invest anyway, ""you have to make sure that it's money that you can really afford to lose,"" Jariwala said.Boneparth agrees: ""Be very careful about how much you allocate and understanding what you can tolerate, because if 80% of your net worth is tied to bitcoin, and it goes down 30%, that's rough.""Depending on what you can afford, a smaller allocation in bitcoin can hedge any potential downturns in the market.Sign up now: Get smarter about your money and career with our weekly newsletterDon't miss: This 29-year-old launched a business to support Black NFT artists—and it made $140,000 in 10 months"
2022-01-21,"Shares of MicroStrategy tumbled 17.8% Friday afternoon after the U.S. Securities and Exchange Commission reportedly rejected the company's bitcoin accounting strategy.The business-intelligence software company's stock had been falling in tandem with the price of bitcoin, which dropped more than 10% Friday to its lowest point since August. MicroStrategy shares are down 24.7% for the week.A filing released Thursday showed the SEC rejecting the accounting method MicroStrategy was using for bitcoin in its earnings reporting.""We note your response to prior comment 5 and we object to your adjustment for bitcoin impairment charges in your non-GAAP measures,"" the filing said. ""Please revise to remove this adjustment in future filings."" MicroStrategy began buying bitcoin as part of a capital allocation strategy in 2020, setting it apart from other companies. It has been aggressively buying bitcoin ever since, making its shares a proxy for the cryptocurrency.As of the end of 2021, MicroStrategy held 124,391 bitcoins, acquired for roughly $3.75 billion at an average price of about $30,159 per bitcoin, CEO Michael Saylor announced on Twitter at the time."
2022-01-21,"Bitcoin prices fell sharply on Friday, while ether prices also dived, wiping off nearly $150 billion from the crypto market.Bitcoin fell about 15% and was trading around $36,000 late Friday, according to Coin Metrics. Ether, the second-largest cryptocurrency by market cap, dived about 20% to trade around $2,500.The declines in cryptocurrencies follow Wall Street losses on Thursday. The Nasdaq Composite lost 7.6% this week, and the S&P 500 fell 5.7% for its third straight weekly decline.Rising rates have prompted investors to shed positions in riskier assets. Earlier this week, the benchmark 10-year Treasury yield traded above 1.9%.The Federal Reserve have also indicated it plans to begin reducing its balance sheet, as well as tapering of bonds and raising interest rates. A common investment case for bitcoin is that it serves as a hedge against rising inflation as a result of government stimulus, but analysts are saying the risk is that a more hawkish Federal Reserve may take the wind out of bitcoin's sails.Bitcoin prices have fallen sharply since November, tumbling more than 40% from a record high of about $69,000.Some experts warn that the crypto market could be heading toward a downturn soon, as heightened regulatory scrutiny and intense price fluctuations dampened bitcoin's prospects. Read more about tech and crypto from CNBC ProGoldman Sachs loves Uber, Meta and Amazon — and ranks them in order of preferenceBroadcom bolsters stock with new Apple deal. Here's why the experts like itHere are Cowen's top chip picks for an EV and autonomous-auto future Goldman Sachs loves Uber, Meta and Amazon — and ranks them in order of preferenceBroadcom bolsters stock with new Apple deal. Here's why the experts like itHere are Cowen's top chip picks for an EV and autonomous-auto future Regulators are cracking down on cryptocurrencies too. China completely banning all crypto-related activities and U.S. authorities are also clamping down on certain aspects of the market.— CNBC's Ryan Browne contributed to this report.Correction: This article has been updated to reflect that bitcoin's all-time high in November was about $69,000."
2022-01-24,"""Look, my view of it is evolving,"" Blankfein said. ""I can't predict the future, but I think it's a big thing to be able to predict the present, like, 'What is happening?' And I look at the crypto, and it is happening.""By ""happening,"" Blankfein means the ecosystem around cryptocurrencies has matured in the past year, he said.""It's lost a lot of value, but at a point where it's trillions of dollars of value contributing to it and the whole ecosystem growing around it,"" he said. Former Goldman Sachs Chairman and CEO Lloyd Blankfein said his view of cryptocurrencies has evolved after digital assets attracted trillions of dollars in value and a rapidly growing ecosystem.On Monday, Blankfein was asked by CNBC's Andrew Ross Sorkin on ""Squawk Box"" for his view on the nascent asset class, who noted that the former banker has voiced skepticism in the past.""Look, my view of it is evolving,"" Blankfein said. ""I can't predict the future, but I think it's a big thing to be able to predict the present, like, 'What is happening?' And I look at the crypto, and it is happening.""By ""happening,"" Blankfein means the ecosystem around cryptocurrencies has matured in the past year, he explained. Traditional financial companies including Goldman have begun offering clients ways to buy, trade and custody digital currencies, and a parallel universe of decentralized finance protocols has emerged so holders can lend out and earn yield on their coins.Cryptocurrencies have been selling off for weeks as expectations of rising interest rates hit riskier assets. The total market cap of cryptocurrencies fell below $2 trillion last week after reaching a high of $3.1 trillion in November.""It's lost a lot of value, but at a point where it's trillions of dollars of value contributing to it and whole ecosystems are growing around it,"" he said. ""Of course, we have the benefits of instantaneous transfer and reduction of credit risk and all the benefits of blockchain.""In the past, Blankfein has criticized bitcoin as a store of value and said that regulators should be ""hyperventilating"" over its rise.""I may be skeptical, but I'm also pragmatic about it,"" Blankfein said Monday. ""And so guess what? I would certainly want to have an oar in that water.""In the wide-ranging interview, Blankfein discussed how uncertainty over inflation has caused bearishness throughout markets in recent weeks. He also said that banks trade at an ""unbelievably low multiple"" and that some of the best investments are made in declining markets."
2022-01-24,"Bitcoin climbed into positive territory after falling below $33,000 to a new low.The No. 1 cryptocurrency and ether are sitting about 45% and 49% from their respective all-time highs.The steep declines have been correlated to the selling seen in higher risk assets like technology stocks as investors prepare for higher interest rates and tighter monetary policy from the Federal Reserve. Bitcoin bounced into positive territory Monday after initially continuing its slide from last week.On Monday, bitcoin fell to $32,982.11, its lowest point since July, according to Coin Metrics, but the largest cryptocurrency by market cap was up 5.6% in afternoon trading, to $37,183.25, as broader equities reversed course and ended the day higher. Earlier in the session, the Dow fell as much as 1,115 points and the S&P 500 briefly fell into correction territory.Ether plunged to as low as $2,176.41, its lowest since July, according to Coin Metrics. It last rose 1.1% to $2,444.85. Bitcoin and ether are about 45% and 49% off their respective all-time highs.Cryptocurrencies have been moving in tandem with stocks, which have continued to fall since the beginning of the year and just came off of their worst week since March 2020. Investors have been selling risk assets like technology stocks, as they prepare for tighter monetary policy from the Federal Reserve.""It's possible that macroeconomic concerns, such as the Fed's response to inflation rates, have facilitated more de-risking activity in general,"" said Juthica Chou, head of OTC options trading at Kraken. ""The recent price drop, coupled with high volatility, could be leading to further selling as participants look to reduce risk."" Loading chart... Investors also are assessing the impact of further regulation on the cryptocurrency market. Last week, Russia's central bank proposed banning the use and mining of cryptocurrencies.Given current market sentiment, bitcoin is likely to test the $30,000-$32,000 range, according to Vijay Ayyar, Luno's vice president of corporate development and international expansion. If the cryptocurrency holds above $30,000 for as long as one week, there could be a base formed at those levels before the market moves higher, he said. However, it could be some time for the market to turn bullish given the lack of confidence across the spectrum, he added.Several other analysts have said they see $30,000 as the next level of support for the cryptocurrency to test. However, analyst John Roque of 22V Research said bitcoin could fall even further. He also has been using $30,000 as a target but noted the median historical bear market for bitcoin is down 78%.  ""A 78% decline from the bitcoin high of nearly $69,000 would imply a potential downside figure of about $15,000,"" he said in a note Monday. ""It's probably safe to say that not one bitcoin bull has that figure in their model. To be sure, we don't either… but we think it's worth keeping in our back pocket in case we need it.""Investors are also grappling with rising inflation. Bitcoin proponents have long suggested the digital coin is a hedge against inflation, but that theory has not held up for many newer investors. As institutional interest poured into bitcoin last year, there are more short-term investors in the crypto market valuing bitcoin like a tech stock than ever before. Analysts have said there's concern a more hawkish Fed could take the wind out of the crypto market's sails.""Looking forward, our most immediate concern is how equities markets respond to this week's Fed meeting, especially after having just endured their worst week since the global onset of Covid,"" said Leah Wald, CEO at digital asset investment manager Valkyrie Funds.""A consolidation in stocks would lead to a risk-on environment where traders are more willing to take on additional risk assets such as bitcoin,"" she added, ""since digital assets have become increasingly correlated to equities as more companies continue to add bitcoin to their balance sheets. Volatility is likely to be a feature of bitcoin for at least the short term, as traders figure out where market sentiment is following this week's Fed meeting."""
2022-01-24,"Charts suggest that the selling in the world's two largest cryptocurrencies may run its course soon, CNBC's Jim Cramer said Monday.""To me, that says it might be too late to sell and you need to consider buying. I know I am, especially if we get a final leg down,"" Cramer said.The ""Mad Money"" host rooted his comments in analysis from veteran technician Tom DeMark. Charts suggest the selling in the world's two largest cryptocurrencies may run its course soon, CNBC's Jim Cramer said Monday, leaning on analysis from veteran technician Tom DeMark.""When the charts, as interpreted by Tom DeMark, say that both bitcoin and ethereum could be looking at downside trend exhaustion bottoms this week, if not today, I think you need to take him seriously,"" the ""Mad Money"" host said.""To me, that says it might be too late to sell and you need to consider buying. I know I am, especially if we get a final leg down,"" added Cramer, who personally owns some ether, which runs on the ethereum blockchain. He previously owned bitcoin, as well.Bitcoin earlier Monday reached its lowest point since July when it fell to $32,982.11 per token, according to Coin Metrics. However, bitcoin reversed course during the trading day, ultimately moving higher to around $36,000. The cryptocurrency remains well off its all-time high of nearly $69,000 reached in the fall.Ether also touched its lowest level since July on Monday, falling as low as $2,176.41 before paring some of those losses, according to Coin Metrics. It's down about 50% from its all-time high. While there's a risk that bitcoin's steep decline in recent weeks could cause structural damage to the cryptocurrency, Cramer said DeMark is betting that will not happen — just like bitcoin's roughly 56% drawdown from April to June 2021 didn't prevent it from setting new highs in the fall. In fact, DeMark notes that bitcoin's current angle of descent is identical to its 2021 plunge, Cramer said. ""In other words, there's a good chance that history continues to repeat itself.""Looking specifically at bitcoin's recent trading, Cramer said the cryptocurrency is at No. 11 of DeMark's well-known 13-session countdown pattern, which the technician uses to identify when a rally or decline will be exhausted. ""We need two more negative closes before his buy trigger fires,"" said Cramer, who added that DeMark also would like to see bitcoin test his downside price targets.If Monday's intraday turnaround ends up leading to only a brief rally, ""DeMark wouldn't be surprised to see bitcoin getting hit with a two- or three-day panic selling climax, which could briefly take it all the way down to 26,355,"" Cramer said. Ether ""has already hit 13 on his buy countdown for the first time since the peak. That tells DeMark that we could be looking at a trend exhaustion bottom,"" Cramer said, noting that ""fortunately"" ether also fell beneath DeMark's downside price projection of $2,434.Despite these positive technical indications, DeMark cautions that ether may still fall further. ""If we get another panicked breakdown, he could see [ether] temporarily dipping to $1,859 in a selling climax, but that would be your moment to buy, not sell, into the teeth of the panic,"" Cramer said.Sign up now for the CNBC Investing Club to follow Jim Cramer's every move in the market. DisclaimerQuestions for Cramer? Call Cramer: 1-800-743-CNBCWant to take a deep dive into Cramer's world? Hit him up! Mad Money Twitter - Jim Cramer Twitter - Facebook - InstagramQuestions, comments, suggestions for the ""Mad Money"" website? madcap@cnbc.com"
2022-01-25,"The IMF is urging El Salvador to discontinue bitcoin's status as legal tender.In September 2021, El Salvador became the first country to adopt the world's biggest cryptocurrency as legal tender, alongside the U.S. dollar. The International Monetary Fund is pushing El Salvador to ditch bitcoin as legal tender, according to a statement released on Tuesday.IMF directors ""stressed that there are large risks associated with the use of bitcoin on financial stability, financial integrity, and consumer protection, as well as the associated fiscal contingent liabilities.""The report, which was published after bilateral talks with El Salvador, went on to ""urge"" authorities to narrow the scope of its bitcoin law by removing bitcoin's status as legal money. In September 2021, the Central American nation became the world's first country to adopt the cryptocurrency as legal tender, alongside the U.S. dollar.Salvadoran President Nayib Bukele — who has tethered his political fate to the success of the country's bitcoin experiment — has added hundreds of bitcoin to the country's balance sheet in recent months. On Friday, the president tweeted that he bought an additional $15 million of ""really cheap"" bitcoin, as the crypto market plummeted. Bitcoin is down about 50% from its November record high. The IMF report went on to say that some directors had expressed concern over the risks associated with issuing bitcoin-backed bonds, referring to the president's plan to raise $1 billion via a ""Bitcoin Bond"" in partnership with Blockstream, a digital assets infrastructure company.Part of El Salvador's nationwide move into bitcoin also involved launching a national virtual wallet called Chivo that offers no-fee transactions and allows for quick cross-border payments. For a country where 70% of citizens do not have access to traditional financial services, Chivo is meant to offer a convenient onramp for those who have never been a part of the banking system. IMF directors agreed that the Chivo e-wallet could facilitate digital means of payment, thereby helping to ""boost financial inclusion,"" though they emphasized the need for ""strict regulation and oversight."" Many Salvadorans have reported cases of identity theft, in which hackers use their national ID number to open a Chivo e-wallet, in order to claim the free $30 worth of bitcoin offered by the government as an incentive to open a digital wallet.For months, the IMF has bemoaned Bukele's bitcoin experiment.Tuesday's statement echoes a report shared by the IMF in November, in which the financial regulator wrote that bitcoin's high price volatility translated to significant risks to consumer protection and noted that bitcoin should not be used as legal tender.El Salvador has also been trying since early 2021 to secure a $1.3 billion loan from the IMF — an effort that appears to have soured over this bitcoin row.The country will need to figure out some other backstop to shore up its finances. The IMF predicts that under current policies, public debt will rise to 96% of GDP by 2026, putting the country on ""an unsustainable path."""
2022-01-25,"Indonesia's Financial Services Authority (OJK) on Tuesday warned that financial firms are not allowed to offer and facilitate sales of crypto assets amid a boom in crypto trading in Southeast Asia's largest economy.It warned that the value of crypto assets often fluctuates and that people buying into the digital assets should fully understand the risks.""Please beware of allegations of Ponzi scheme scams in crypto investments,"" it added, without elaborating. Indonesia's Financial Services Authority (OJK) on Tuesday warned that financial firms are not allowed to offer and facilitate sales of crypto assets amid a boom in crypto trading in Southeast Asia's largest economy.""OJK has strictly prohibited financial service institutions from using, marketing, and/or facilitating crypto asset trading,"" the regulator said in a statement posted on Instagram.It warned that the value of crypto assets often fluctuates and that people buying into the digital assets should fully understand the risks.""Please beware of allegations of Ponzi scheme scams in crypto investments,"" it added, without elaborating.The warning follows similar concerns by the central banks of Thailand.Trade in crypto assets is surging in Indonesia, with total 2021 transactions reaching 859 trillion rupiah ($59.83 billion), up from just 60 trillion rupiah in 2020, media reported, citing trade ministry data. Read more about tech and crypto from CNBC ProHedge funds piled into these A.I. stocks during the first quarterWatch Elon Musk's full interview with CNBC's David Faber on Twitter, Tesla and A.I. advancesBank of America says buy these five tech stocks before it's too late Hedge funds piled into these A.I. stocks during the first quarterWatch Elon Musk's full interview with CNBC's David Faber on Twitter, Tesla and A.I. advancesBank of America says buy these five tech stocks before it's too late Indonesia allows sales of crypto assets in the commodities exchange and trading is supervised by the trade ministry and the Commodity Futures Trading Regulatory Agency, not by the OJK.The ministry is currently facilitating the set up of a separate bourse for digital assets, called the Digital Futures Exchange, which officials say will be launched in the first quarter.However, crypto currencies cannot legally be used for payments in the country."
