time,body
2022-01-04,"The Ethereum Name Service (ENS), a protocol that sells nonfungible tokens (NFTs) of domains representing wallet addresses, generated buzz within the crypto community in November after it airdropped tokens to its users. Those who claimed the tokens earned governance rights over the ENS and can vote on future decisions regarding the protocol.It was so well received that it prompted other Ethereum projects to airdrop tokens too. Though airdrops aren't new, they've recently become increasingly common.In an airdrop, projects distribute tokens to specific investors' wallets. In some situations, like with the ENS, projects airdrop tokens to those who have used their product. Other times, projects airdrop tokens to potential investors in hopes of marketing their product.The process of receiving the airdropped tokens can differ too. Sometimes, investors must choose to accept the tokens by claiming them, while other times, investors cannot reject the airdrop and tokens are automatically dropped in their wallets.The ENS airdrop seems legitimate, as the ENS has existed for years and it required investors to vote on a ""foundational ENS governance constitution"" that detailed the authority of holders before claiming their tokens. But airdrops are often used by crypto scammers. In some cases, they may try to airdrop fictitious tokens to an investor's wallet to prompt them to visit a phishing website.It can be difficult to tell whether an airdrop is safe or not, and investors should be cautious. Before claiming airdropped tokens or interacting with any that may have landed in your wallet, there are a few things to do first. If you have the option to claim airdropped tokens, you should first look into the project distributing and see whether it has a viable product.Even if the airdropped token is safe to claim, its project may be designed to benefit a select few founders or core contributors. Details about a drop and its project can be found in its code, on its website or via its social media. Look into a project's fundamentals and what it proposes before connecting your wallet to its website.Both the OpenDAO and Gas DAO, two Ethereum-based projects, recently airdropped tokens, which quickly surged in value before declining. While the airdrops garnered excitement from some, others expressed concern, saying the projects behind the tokens lacked product development, utility and had security risks. This isn't uncommon.If tokens land in your wallet through an airdrop you didn't initiate, it's best to wait before engaging. Some airdrops may prompt you to visit a website to sell or swap the tokens, but there's a possibility it's a phishing attempt to access your wallet and funds. When researching, there are a few common red flags to be aware of, many of which can be seen when analyzing a project's smart contract, which are collections of code that carry out a set of instructions on the blockchain.For one, if a project lacks on-chain security to protect funds, its founders or developers might be able to control the movement of funds. This commonly happens in ""pump and dump"" or ""rug pull"" schemes, where developers abandon a project and leave with investors' funds.In addition, it might be a bad sign if a project airdropping tokens doesn't have a product, plan, governance outline or other things of that nature. Claiming tokens now with the promise of being told details later can be dangerous. While this can sometimes also be the case for early crypto projects, where there isn't any malice, it's worth keeping in mind.Project founders should be somewhat receptive to answering questions on Discord or Twitter, especially if people are calling out potential issues or concerns. If they aren't, that can be a red flag as well.Another is if a project charges a fee when you try to swap or sell the tokens, or simply doesn't allow you to swap or sell at all. Smart contracts are essential for most crypto-based projects to run. Although they can be quite technical, it's worth checking out the smart contract behind a project, or asking someone knowledgeable about the space to do so. If there is an issue with a developer's code, intentionally or not, then there could potentially be weaknesses within the project.Sign up now: Get smarter about your money and career with our weekly newsletterDon't miss:You could be leaving your crypto wallet open to hackers—here's how to protect it'People have been participating without understanding the risks': Here's what to know about cryptocurrency-based DeFiElon Musk continues to tweet about altcoins like baby dogecoin—but investors should tread very carefully"
2022-01-04,"China's central bank has launched a pilot version of a wallet app for the digital yuan in a push to expand its usage to more people.So far, China has done a number of trials around the country in the form of lotteries where users in certain cities have been given a small amount of the digital currency to spend.But now more people in certain cities can download the app, highlighting how China is trying to get more people to use the digital currency. China's central bank has launched a pilot version of a wallet app for the digital yuan in a push to expand its usage to more people.The app is available on China's Android app stores and Apple's app store. It allows users to open a digital yuan wallet and spend the currency.The digital yuan or e-CNY is a digital version of China's sovereign currency and has been in the works since 2014. It is not a cryptocurrency like bitcoin but is instead issued and controlled by the People's Bank of China.So far, China has done a number of trials around the country in the form of lotteries where users in certain cities have been given a small amount of digital currency to spend. Some retailers, such as e-commerce company JD.com, have accepted it as payment in the past year.But the digital yuan has not yet officially been rolled out nationally and there is no timeline for this.The new app allows users in 10 areas including major cities Shanghai and Beijing to use it. Previously, only select users could use the app on an invitation basis. But now everyone can download the app, highlighting how China is trying to get more people to use the digital currency. The ""Beijing Winter Olympics areas"" is one of the places that the digital yuan can be used, according to a notice on the app. The Winter Olympics, which takes place this year in the Chinese capital, has been one of the events that the People's Bank of China has been targeting bringing the digital yuan to.Still, the e-CNY app will face stiff competition from China's two dominant digital payment apps — Ant Group's Alipay and Tencent's WeChat."
2022-01-04,"Bitcoin could see further upside and reach $100,000 by the middle of this year, claims Antoni Trenchev of crypto lender Nexo.Bitcoin has been a winner in the pandemic era, rising more than 80% in 2021 despite being far off record highs hit earlier that year.However, some experts have warned that bitcoin may be poised for a steep drop in the coming months. Bitcoin could see further upside and surge as high as $100,000 by the middle of 2022, according to Antoni Trenchev of cryptocurrency lender Nexo.The world's largest cryptocurrency by market cap was trading at $46,170.43 as of 8:42 p.m. ET Monday, according to data from Coin Metrics.""I think [bitcoin's] going to reach $100,000 this year, probably by … the middle of it,"" Trenchev, co-founder and managing partner at Nexo, told CNBC's ""Street Signs Asia"" on Monday. The firm claims to be the world's largest lending institution in the digital finance industry, according to its website. The company has issued more than $6 billion in credit and manages assets for more than 2.5 million users globally, it said.Bitcoin has largely been a winner in the pandemic era, rising more than 60% in 2021 despite being far off its record high of around $69,000 earlier that year. In comparison, the S&P 500 rose nearly 27% during the same period, while the Dow and Nasdaq gained 18.73% and 21.39% for the year, respectively.But not everyone is as bullish as Trenchev.Some experts have warned that bitcoin may be poised for a steep drop in the coming months. Carol Alexander, professor of finance at Sussex University, said she sees bitcoin tanking as low as $10,000 in 2022, virtually wiping out all of its gains in the past year and a half. Lingering regulatory scrutiny on the sector and wild price swings could also weigh on the outlook for bitcoin.On his part, Trenchev said there were ""two simple reasons"" why he sees big gains ahead for bitcoin.One is that institutions are ""building out their treasuries"" and filling it with the cryptocurrency, he said, without providing any examples. Firms such as MicroStrategy and Square are among known examples of companies that have bought massive amounts of bitcoin.Another reason is his prediction that ""cheap money"" is here to stay — which will be a boon for cryptocurrencies. Read more about tech and crypto from CNBC ProGoldman Sachs loves Uber, Meta and Amazon — and ranks them in order of preferenceBroadcom bolsters stock with new Apple deal. Here's why the experts like itHere are Cowen's top chip picks for an EV and autonomous-auto future Goldman Sachs loves Uber, Meta and Amazon — and ranks them in order of preferenceBroadcom bolsters stock with new Apple deal. Here's why the experts like itHere are Cowen's top chip picks for an EV and autonomous-auto future His comments come despite expectations the Federal Reserve could raise interest rates several times this year for the first time in the pandemic era as the U.S. central bank seeks to combat inflation. The Fed was among major central banks that took unprecedented monetary easing steps in 2020 to keep financial markets afloat during the early days of the pandemic.Admitting his ""contrarian"" view of lasting easy monetary policy, Trenchev said most people likely ""got it wrong"" in their Fed rate hike expectations.""I quite frankly think that as soon as we see a rate hike, it's going to be a dip into equities and the bond market — and quite frankly, the last few years, we haven't seen much political will to … power through any sort of correction in the traditional financial markets,"" he said.— CNBC's Ryan Browne contributed to this report."
2022-01-05,"After a record-breaking year for cryptocurrency in 2021, many investors may soon face a hefty tax bill for their good fortune.But it can be difficult to calculate digital asset balances without Form 1099-B, summarizing profits and losses.  After a record-breaking year for cryptocurrency in 2021, many investors may soon face a hefty tax bill for their good fortune. The digital asset market value soared past $2 trillion, with bitcoin reaching an all-time high above $69,000 in November and ether surging to nearly $5,000 during the same period.While prices dipped in December, many investors still saw sizable year-over-year growth. More from Smart Tax Planning:Here's a look at more tax-planning news.Here's how to get a faster tax refundWhen to expect key forms for filing your tax returnElectric vehicle tax credits will be harder to get Here's a look at more tax-planning news.Here's how to get a faster tax refundWhen to expect key forms for filing your tax returnElectric vehicle tax credits will be harder to get ""Be prepared to pay some tax,"" said enrolled agent Adam Markowitz, vice president at Howard L Markowitz PA, CPA in Leesburg, Florida.But calculating your balance can be tricky, he said, particularly if it was a year of heavy trading. Loading chart... Since cryptocurrency is considered property, it may be subject to capital gains when exchanged or sold at a profit.    If you exchange digital coins, cash out to U.S. dollars or make a purchase, it may be a taxable event, said Matt Metras, an enrolled agent and cryptocurrency tax specialist at MDM Financial Services in Rochester, New York.The gain or loss is the difference between your purchase price, known as the basis, and value upon sale or exchange, and tax rates depend on how long you have owned the coin.  You may qualify for long-term capital gains rates of 0%, 15% or 20%, depending on taxable income, if you hold the currency for more than one year. However, selling or exchanging assets after less than one year triggers short-term capital gains, with regular income tax rates, up to 37% for top earners.And many crypto investors trade digital coins frequently, according to a CNBC survey, with roughly one-third trading weekly or monthly, and nearly a quarter trading daily.   One of the biggest crypto tax challenges is many investors don't keep records of transactions, and it's difficult for exchanges to track assets moving between wallets and brokers. For example, if you bought bitcoin on Coinbase, transferred it to your wallet and then moved it to Gemini, the second exchange wouldn't know the original purchase price, Metras said.  While the deadline for Form 1099-B, which brokers use to report an investor's profits and losses, is Jan. 31, it's unclear which crypto exchanges, if any, will send these forms for 2021.Despite limited reporting, the IRS still expects you to report crypto transactions, Markowitz said. If exchanges don't provide Form 1099-B, you may be left with each broker's spreadsheet of transactions or other reporting options, which may still be difficult to reconcile.""The best thing to do is try to reverse-engineer it,"" said Metras.You can reconstruct records by importing each exchange's files into crypto tax reporting software. ""It is overwhelming when it's a big mess,"" Metras said. ""But everything adds up eventually.""There are several companies that can provide Form 8949 to summarize crypto activity and file your returns, Markowitz said.However, errors may be possible, and the reporting may not be sufficient for an IRS audit, he added."
2022-01-05,"NFTs could become ""a much bigger, more fluid market"" than bitcoin, ""Shark Tank"" investor Kevin O'Leary predicted.His belief in NFTs stems from the idea that can they prove ownership of real-world items, such as designer watches or flash cars.""We'll see what happens but I'm making that bet and I'm investing on both sides of that equation,"" O'Leary told CNBC. ""Shark Tank"" investor Kevin O'Leary is a big believer in non-fungible tokens — he even thinks they have a shot at becoming bigger than bitcoin.O'Leary, the chairman of O'Shares Investment Advisers, said his belief in NFTs stems from the idea that can they prove ownership of real-world items, such as designer watches or flash cars, digitally rather than with paper records.NFTs are one-of-a-kind crypto tokens that serve to track the provenance and authenticity of rare virtual collectible items such as art and sports memorabilia. There have also been efforts to bring NFTs to physical assets.""You're going to see a lot of movement in terms of doing authentication and insurance policies and real estate transfer taxes all online over the next few years, making NFTs a much bigger, more fluid market potentially than just bitcoin alone,"" O'Leary told CNBC's ""Capital Connection"" Wednesday.""We'll see what happens but I'm making that bet and I'm investing on both sides of that equation.""Barely anyone had heard of NFTs in 2020, but they became a huge phenomenon the following year. More than $20 billion worth of the tokens changed hands throughout 2021, according to some estimates. The trend gained particular public attention after a collage by the digital artist Beeple, whose real name is Mike Winkelmann, was sold for a record $69 million. However, there are concerns about the sustainability of the market. Some have compared it to the initial coin offering frenzy of 2017, which saw several investors get defrauded by betting on start-ups through unregulated token sales. Meanwhile, there have been a number of scams and instances of stolen art, raising red flags for some traders. The millionaire Canadian investor has changed his tune on crypto over the years, having previously called bitcoin ""garbage.""""It is a useless currency,"" O'Leary told CNBC's ""Squawk Box"" in May 2019. ""It's worthless.""More recently, O'Leary has warmed to the space, viewing it as a way of diversifying from other assets such as real estate amid rising inflation. He is particularly bullish on ""decentralized finance,"" a trend that aims to replicate traditional financial products using blockchain.O'Leary recently disclosed that his largest position is in ether, while he also owns some polygon, solana and bitcoin.Around 40% of new checks O'Leary has written in the last six months were for crypto and blockchain-related ventures. O'Leary stressed the importance of ensuring crypto becomes regulated. Regulators in the U.S. and elsewhere are racing to catch up with developments in the market to prevent potential money laundering and protect consumers from financial harm.""Different geographies have different policy regarding crypto,"" O'Leary said. ""You have to go and find jurisdictions that are more progressive."" He cited Canada, his home country, as an example of a jurisdiction that is more progressive than others on the issue of crypto.Canada was the first to approve an exchange-traded fund that gives investors exposure to bitcoin. Though the U.S. Securities and Exchange Commission has since greenlit a bitcoin-linked ETF, the product tracks futures contracts instead of investing in bitcoin directly.O'Leary also cited the United Arab Emirates and Switzerland as other countries that are opening up to crypto.""You have to be optimistic and constructive,"" O'Leary said. ""The floodgate of capital will come in through sovereign and pension plans that doesn't exist yet.""Of particular concern to regulators are stablecoins, digital tokens pegged to the value of sovereign currencies like the dollar. Economists worry notable stablecoins like tether and USD Coin may not have the appropriate reserves available to justify their claims of being backed by dollars.""I think [stablecoins] will also get a chance to shine in the sun as a great way to get yield when you can't get any yield on cash,"" O'Leary said."
2022-01-05,"According to billionaire investor Ray Dalio, it's reasonable for everyday investors to hold a small amount of bitcoin, the largest cryptocurrency by market value.So how much exactly?On a recent episode of the We Study Billionaires podcast, Dalio was asked by co-host William Green whether allocating 1% to 2% of one's portfolio to bitcoin was reasonable.""I think that's right,"" Dalio replied.Dalio owns ""a little bit"" of bitcoin himself, he previously disclosed.Dalio acknowledges that bitcoin has ""pros and cons"": Though it has become prominent, he told Green he has concerns about the government outlawing the cryptocurrency and about its use in ransomware attacks.That's in part why his stance on the cryptocurrency isn't ""black and white,"" Dalio said.Dalio also touched on the fact that bitcoin is seen as a digital gold and hedge against inflation by its supporters. He said it can be compared to gold, because, by design, there is a limited supply of bitcoin.""I think over time, inflation-hedge assets are probably likely to do better,"" Dalio told Green. ""That's why I'm not favorable to cash and those types of things.""Diversification is extremely important, Dalio told Green. But even when it comes to bitcoin, ""one wonders, when does somebody take the money they made in bitcoin and then diversify that? There are other things that are developing, not only other coins, but nonfungible tokens and other things that become popular with that crowd. Does that diversify [bitcoin]?""Nonetheless, as Dalio said in December, bitcoin ""has some merit as a small portion of a portfolio.""Sign up now: Get smarter about your money and career with our weekly newsletterDon't miss: Billionaire Ray Dalio: Bitcoin is like ‘a younger generation’s alternative to gold’ and has ‘merit’"
